{
  "$schema": "./export-bridge.schema.json",
  "version": 1,
  "generator": "Core/Rikarin.Skala.Options/tools/import-options.py",
  "notes": [
    "The bridge between ReSharper's key namespace and Skala's, in the one direction that still exists. Skala's own keys are `skala_*`; this file records the spelling(s) the Rider export (`editor_config_template`) writes for each of them. It is the only place in the option registry that names another tool's keys.",
    "⚠ Provenance, not ingestion. Nothing here is indexed by `OptionRegistry.TryResolve`, so a `resharper_*` key in a user's .editorconfig is still an unknown key (SK9001). Three consumers read it as an artefact: `CanonicalEditorConfig.Compose`, which translates the export into the payload `skala config sync` ships; `OracleRunner`, which has to speak this namespace to `jb cleanupcode` because that is the only namespace it understands; and `EditorConfigIngestionTests`.",
    "⚠ The mapping is recorded, not computed. `skala_x` is `resharper_x` for some keys and `resharper_csharp_x` for others, and most keys carry both plus unprefixed forms, so no rule derives it. Delete an entry and the key-flip sweep reports that option INERT — silently, because the oracle ignores a key it cannot read — and the canonical payload loses the line.",
    "⚠ Order within each array is significance order, most specific first, and is load-bearing twice: `CanonicalEditorConfig.Translate` uses the index as the specificity rank when the export sets one option under two spellings in one section, and `ExportSpellings.ForOracle` hands element 0 to the oracle. Handing the oracle a generic spelling whose specific spelling the export also sets would leave the export's value in force and measure nothing.",
    "Every option in options.json has an entry here and every entry names an option that exists; the generator fails the build (SKG006, SKG007) if either stops being true.",
    "`unmapped` is the other half: foreign keys that options.json's measurements name but that Skala carries no option for. They are here so that a measurement stays reproducible — a reader who wants to repeat a negative control needs the exact spelling — without options.json holding it. ⚠ Not all of them are export keys: `braces_for_ifelse` and `remove_this_qualifier` are the reference formatter's settings, verified absent from `editor_config_template` on 2026-09-04; the other three the export does write."
  ],
  "unmapped": {
    "resharper_braces_for_ifelse": "csharp_prefer_braces' negative control. Flat at required, not_required and required_for_multiline under both oracle profiles, which is what shows neither profile performs brace insertion at all. ⚠ Not written by the export.",
    "resharper_csharp_align_multiline_argument": "Named by skala_allow_far_alignment's measurement. The export sets it false at editor_config_template:262; the probe that overturned the OfInert registration set it true.",
    "resharper_new_line_before_enumerators": "The key that actually chops an enum under this export (editor_config_template:413, = true). It is what masks skala_wrap_enum_declaration and skala_max_enum_members_on_line.",
    "resharper_parentheses_non_obvious_operations": "Shift and the bitwise family, which dotnet_style_parentheses_in_arithmetic_binary_operators does not govern (editor_config_template:426).",
    "resharper_remove_this_qualifier": "Named by dotnet_style_qualification_for_field: the key the oracle does NOT read for `this.` (SK-DIV-0070). ⚠ Not written by the export."
  },
  "spellings": {
    "charset": [
      "charset"
    ],
    "csharp_indent_braces": [
      "csharp_indent_braces"
    ],
    "csharp_new_line_before_members_in_object_initializers": [
      "csharp_new_line_before_members_in_object_initializers"
    ],
    "csharp_new_line_before_open_brace": [
      "csharp_new_line_before_open_brace"
    ],
    "csharp_new_line_between_query_expression_clauses": [
      "csharp_new_line_between_query_expression_clauses"
    ],
    "csharp_prefer_braces": [
      "csharp_prefer_braces"
    ],
    "csharp_preferred_modifier_order": [
      "csharp_preferred_modifier_order"
    ],
    "csharp_preserve_single_line_blocks": [
      "csharp_preserve_single_line_blocks"
    ],
    "csharp_space_after_dot": [
      "csharp_space_after_dot"
    ],
    "csharp_space_after_keywords_in_control_flow_statements": [
      "csharp_space_after_keywords_in_control_flow_statements"
    ],
    "csharp_space_around_binary_operators": [
      "csharp_space_around_binary_operators"
    ],
    "csharp_space_before_dot": [
      "csharp_space_before_dot"
    ],
    "csharp_space_before_open_square_brackets": [
      "csharp_space_before_open_square_brackets"
    ],
    "csharp_space_between_method_call_name_and_opening_parenthesis": [
      "csharp_space_between_method_call_name_and_opening_parenthesis"
    ],
    "csharp_space_between_method_declaration_name_and_open_parenthesis": [
      "csharp_space_between_method_declaration_name_and_open_parenthesis"
    ],
    "csharp_space_between_parentheses": [
      "csharp_space_between_parentheses"
    ],
    "csharp_space_between_square_brackets": [
      "csharp_space_between_square_brackets"
    ],
    "csharp_style_namespace_declarations": [
      "csharp_style_namespace_declarations"
    ],
    "csharp_style_prefer_utf8_string_literals": [
      "csharp_style_prefer_utf8_string_literals"
    ],
    "csharp_style_var_elsewhere": [
      "csharp_style_var_elsewhere"
    ],
    "csharp_style_var_for_built_in_types": [
      "csharp_style_var_for_built_in_types"
    ],
    "csharp_style_var_when_type_is_apparent": [
      "csharp_style_var_when_type_is_apparent"
    ],
    "csharp_using_directive_placement": [
      "csharp_using_directive_placement"
    ],
    "dotnet_separate_import_directive_groups": [
      "dotnet_separate_import_directive_groups"
    ],
    "dotnet_style_parentheses_in_arithmetic_binary_operators": [
      "dotnet_style_parentheses_in_arithmetic_binary_operators"
    ],
    "dotnet_style_parentheses_in_other_binary_operators": [
      "dotnet_style_parentheses_in_other_binary_operators"
    ],
    "dotnet_style_parentheses_in_relational_binary_operators": [
      "dotnet_style_parentheses_in_relational_binary_operators"
    ],
    "dotnet_style_predefined_type_for_locals_parameters_members": [
      "dotnet_style_predefined_type_for_locals_parameters_members"
    ],
    "dotnet_style_predefined_type_for_member_access": [
      "dotnet_style_predefined_type_for_member_access"
    ],
    "dotnet_style_prefer_collection_expression": [
      "dotnet_style_prefer_collection_expression"
    ],
    "dotnet_style_qualification_for_event": [
      "dotnet_style_qualification_for_event"
    ],
    "dotnet_style_qualification_for_field": [
      "dotnet_style_qualification_for_field"
    ],
    "dotnet_style_qualification_for_method": [
      "dotnet_style_qualification_for_method"
    ],
    "dotnet_style_qualification_for_property": [
      "dotnet_style_qualification_for_property"
    ],
    "dotnet_style_require_accessibility_modifiers": [
      "dotnet_style_require_accessibility_modifiers"
    ],
    "end_of_line": [
      "end_of_line"
    ],
    "file_header_template": [
      "file_header_template"
    ],
    "indent_size": [
      "indent_size"
    ],
    "indent_style": [
      "indent_style"
    ],
    "max_line_length": [
      "max_line_length"
    ],
    "skala_accessor_owner_body": [
      "resharper_accessor_owner_body",
      "resharper_csharp_accessor_owner_body",
      "csharp_accessor_owner_body",
      "accessor_owner_body"
    ],
    "skala_align_linq_query": [
      "resharper_align_linq_query",
      "resharper_csharp_align_linq_query",
      "csharp_align_linq_query",
      "align_linq_query"
    ],
    "skala_align_multiline_array_and_object_initializer": [
      "resharper_align_multiline_array_and_object_initializer",
      "resharper_csharp_align_multiline_array_and_object_initializer",
      "csharp_align_multiline_array_and_object_initializer",
      "align_multiline_array_and_object_initializer"
    ],
    "skala_align_multiline_binary_expressions_chain": [
      "resharper_align_multiline_binary_expressions_chain",
      "resharper_csharp_align_multiline_binary_expressions_chain",
      "csharp_align_multiline_binary_expressions_chain",
      "align_multiline_binary_expressions_chain"
    ],
    "skala_align_multiline_binary_patterns": [
      "resharper_align_multiline_binary_patterns",
      "resharper_csharp_align_multiline_binary_patterns",
      "csharp_align_multiline_binary_patterns",
      "align_multiline_binary_patterns"
    ],
    "skala_align_multiline_comments": [
      "resharper_align_multiline_comments",
      "resharper_csharp_align_multiline_comments",
      "csharp_align_multiline_comments",
      "align_multiline_comments"
    ],
    "skala_align_multiline_extends_list": [
      "resharper_csharp_align_multiline_extends_list",
      "resharper_align_multiline_extends_list",
      "csharp_align_multiline_extends_list",
      "align_multiline_extends_list"
    ],
    "skala_align_multiline_list_pattern": [
      "resharper_align_multiline_list_pattern",
      "resharper_csharp_align_multiline_list_pattern",
      "csharp_align_multiline_list_pattern",
      "align_multiline_list_pattern"
    ],
    "skala_align_multiline_property_pattern": [
      "resharper_align_multiline_property_pattern",
      "resharper_csharp_align_multiline_property_pattern",
      "csharp_align_multiline_property_pattern",
      "align_multiline_property_pattern"
    ],
    "skala_align_multiline_statement_conditions": [
      "resharper_align_multiline_statement_conditions",
      "resharper_csharp_align_multiline_statement_conditions",
      "csharp_align_multiline_statement_conditions",
      "align_multiline_statement_conditions"
    ],
    "skala_align_multiline_switch_expression": [